{"$schema":"https://json-schema.org/draft/2020-12/schema","type":"object","additionalProperties":false,"required":["dataset_id","song_id","sample_id","source_relative_path","source_sha256","source_size_bytes","source_duration_seconds","probe_seconds","target_sample_rate_hz","target_sample_count","crop_resample_contract","preparation_status","semantic_identity_json","semantic_identity_sha256"],"properties":{"dataset_id":{"type":"string"},"song_id":{"type":"string"},"sample_id":{"type":"string"},"source_relative_path":{"type":"string"},"source_sha256":{"type":"string","pattern":"^[0-9a-f]{64}$"},"source_size_bytes":{"type":"integer"},"source_duration_seconds":{"type":"number"},"probe_seconds":{"const":45},"target_sample_rate_hz":{"const":24000},"target_sample_count":{"const":1080000},"crop_resample_contract":{"type":"string"},"preparation_status":{"const":"SPECIFIED_NOT_EXECUTED"},"semantic_identity_json":{"type":"string"},"semantic_identity_sha256":{"type":"string","pattern":"^[0-9a-f]{64}$"}}}
